author,url,text,section,title,sub_title,date
Deutsche Welle,https://www.cartacapital.com.br/sociedade/pobreza-no-brasil-dispara-e-atinge-mais-de-43-milhoes-de-pessoas/,"O documento intitulado , demonstra que o aumento da pobreza nesse período foi de 3%, ou seja, um número adicional de 7,3 milhões de brasileiros passou a viver com até 5,50 dólares por dia.No ano de 2014, o total de brasileiros que viviam na pobreza era de 36,2 milhões (17,9%). O quadro negativo teve início com a forte recessão que o país atravessou a partir do segundo semestre daquele ano, que durou até o fim de 2016.  O  avalia que o fraco crescimento da América Latina e Caribe, especialmente na América do Sul, afetou os indicadores sociais no Brasil, país que possui um terço da população de toda a região.Mesmo assim, o Banco Mundial manteve as previsões de crescimento do Produto Interno Bruto (PIB) brasileiro, com altas de 2,2% em 2019 e 2,5% em 2020. As projeções são melhores do que as de outros países, como o México (1,7%), mas ficam abaixo de nações como a Colômbia (3,3%). Os países com previsão de queda no PIB são a Argentina (-1,3%) e a Venezuela (-25%).Para a região da América Latina e Caribe, o crescimento deve ser menor do que o do Brasil. As estimativas iniciais eram de 1,7%, mas, no mais recente relatório, elas despencaram para 0,9%, puxadas pelo péssimo desempenho da Venezuela. O crescimento da América do Sul também deverá sentir os efeitos da crise venezuelana, ficando em apenas 0,4%.  De raízes liberais, o relatório destaca as incertezas quanto à , afirmando que sua aprovação “depende da formação de coalizões”, uma vez que o partido governista não tem maioria no Congresso. A instituição elogia o Brasil por buscar um programa “ambicioso” de reformas, mas afirma que o país é o caso mais preocupante na região depois da Venezuela.O Brasil deverá ter um déficit fiscal de 6,9% do PIB em 2019 e um déficit primário de 1,2% do PIB. A dívida pública deve corresponder a 80% do PIB.“As perspectivas de crescimento para este ano não mostram uma melhora substancial em relação a 2018, como consequência do crescimento débil ou negativo nas três maiores economias da região – Brasil, México e Argentina – e do colapso total na Venezuela”, afirma o relatório. Se excluídos os números venezuelanos, o PIB da América do Sul teria alta de 1,8% em 2019.O relatório afirma que os programas sociais podem ser os mais eficazes amortecedores dos choques econômicos. Segundo o economista-chefe do Banco Mundial para a América Latina e Caribe, Carlos Végh, essas iniciativas são comuns em países desenvolvidos, mas não nessa região.“A região deve desenvolver, além dos programas estruturais existentes, ferramentas de rede de segurança social que possam apoiar os pobres e os mais vulneráveis durante o ciclo de baixa nos negócios”, afirma o relatório.O Banco Mundial afirma que a  e Caribe formam a região com os indicadores mais voláteis em todo o mundo por ser exposta a fatores externos (como preços das commodities e liquidez internacional) e instabilidades institucionais e políticas.O Banco Mundial analisou três indicadores: taxa de desemprego, pobreza e necessidades básicas insatisfeitas (habitação, educação e saneamento).",Sociedade,Pobreza no Brasil dispara e atinge mais de 43 milhões de pessoas,"Número de brasileiros que vivem na pobreza subiu 7,3 milhões desde 2014, atingindo 21% da população",2019-04-05 15:40:34
Reinaldo Canto,https://www.cartacapital.com.br/sociedade/inteligencia-artificial-desperta-fascinio-e-temor-no-brasil-diz-pesquisa/,"O certo é que o avanço da IA ao mesmo tempo que abre enormes possibilidades também apresentam temores diferentes da ficção, mas não menos desafiadores e preocupantes.Isso foi o que constatou a pesquisa realizada pela Market Analysis e cujos resultados estão sendo publicados com exclusividade por .  No início de dezembro do ano passado foram realizadas entrevistas com 513 adultos usuários da internet no país para entender e identificar as percepções da influência da inteligência artificial em diversas áreas e seu impacto no futuro das profissões.Questões como a robotização em atividades industriais; a eficácia dos algoritmos nos atendimentos do dia a dia e até mesmo nas vendas; seu uso nos diagnósticos médicos e até mesmo nas investigações policiais e na Justiça.São inúmeras as suas possibilidades, assim como as dúvidas que nascem da utilização maciça da inteligência artificial impactando a todos seja de maneira mais direta ou indireta. E, claro, o futuro de muitas profissões colocadas em xeque!  A questão do trabalho parece ser o que mais preocupa os brasileiros de maneira geral. A pesquisa revelou que, conforme têm sido abordado com frequência pela mídia, algumas profissões tenderão a simplesmente desaparecer. Sete em cada dez brasileiros entrevistados acreditam que trabalhadores da indústria deverão ser cada vez mais substituídos por máquinas. Uma tendência que já vem sendo observada há algum tempo em linhas de produção ocupadas por robôs. Mas não só. Perguntados sobre outras profissões, a enquete constatou que mais de metade dos pesquisados acredita que contabilistas, faxineiras, motoristas e pesquisadores de mercado, entre outros, estão com suas profissões em sério risco. Já 1 a cada 3 ou 4 entrevistados crêem que até mesmo jornalistas, professores, enfermeiras e mesmo policiais podem desaparecer. Para os entrevistados, profissões como médicos, advogados e terapeutas aparentam estar menos ameaçadas.Interessante notar que os riscos apontados pela pesquisa colocam a inteligência artificial atuando tanto nas atividades de produção tipo “mão na massa” como na coleta e análise de dados. Um leque amplo e profundo nas quais as novas tecnologias podem atuar.Menos assustador e mais positivo quanto às suas consequências, a pesquisa revela as boas expectativas que as pessoas nutrem quanto à influência dessa inteligência artificial em áreas como a saúde, segurança e Justiça. 59% dos ouvidos pela pesquisa acreditam que a IA pode auxiliar os médicos, mas não substituí-los. Situação semelhante no que se refere ao sistema judicial. Apesar de sua contestada eficiência, de cada 10 consultados seis demonstram receio na fria decisão apresentada por dados e números enquanto apenas 27% dos entrevistados conferem apoio a uma realidade em que a inteligência artificial ditaria as sentenças judiciais. Já para a substituição de policiais, 31% ou 1/3 das pessoas que participaram da enquete consideram o uso da IA como uma boa alternativa às falhas humanas cometidas pelos representantes da lei.Uma das menores resistências encontradas na pesquisa se refere à mobilidade urbana, tendo como pano de fundo a irresponsabilidade de motoristas que causam anualmente mais de 50 mil mortes no país. Mais de metade dos entrevistados se mostrou favorável à substituição de policiais rodoviários e motoristas por carros autônomos.Para Fabián Echegaray, diretor-geral da Market Analysis e responsável pela pesquisa, “na medida em que cresça a frustração com o desempenho de alguns profissionais (médicos, motoristas, cuidadores) e algumas instituições (clínicas, polícia militar, justiça), e o discurso da efetividade e ganhos econômicos da robotização se popularizar, é provável imaginar um apoio maior para iniciativas que defendam um mundo governado por algoritmos”.Difícil será imaginar que esse cenário realmente não se aprofunde. A inteligência artificial parece que veio mesmo para ficar e o que precisamos é que ela traga reais benefícios e não seja responsável por amplificar ainda mais problemas como a indiferença às questões sociais e a exacerbação a alguns dos principais desafios da humanidade, entre eles, as mudanças climáticas e a crescente radicalização ideológica.",Sociedade,"Inteligência artificial desperta fascínio e temor no Brasil, diz pesquisa","A IA está entre nós e o mundo será, em parte, governado pelos algoritmos",2019-04-04 17:31:43
Deutsche Welle,https://www.cartacapital.com.br/saude/comer-mal-mata-mais-do-que-cigarro-diz-estudo/,"Segundo o estudo, uma má dieta alimentar é responsável por mais mortes do que qualquer outro fator de risco, incluindo o hábito de fumar. Cerca de 11 milhões de indivíduos morrem todos os anos devido à má alimentação.
Uma em cada cinco mortes no mundo em 2017 estava associada a uma má dieta alimentar, que provoca doenças cardiovasculares,  e diabetes tipo 2. O cigarro matou 8 milhões, afirma o estudo.
O estudo  examinou as tendências de consumo de acordo com 15 fatores, entre 1990 e 2017, em 195 países.  A maior proporção de mortes relacionadas com a dieta alimentar foi registrada no Uzbequistão (195º colocado), seguido por Afeganistão, ilhas Marshall e Papua Nova Guiné. Os países que tiveram a menor proporção desse tipo de morte foram Israel, com apenas 89 óbitos por 100 mil habitantes, seguido por França, Espanha, Japão e Andorra. O Brasil ficou na 50ª colocação.
“Este estudo afirma o que muitos pensam há vários anos: que uma dieta pobre é responsável por mais mortes do que qualquer outro fator de risco no mundo”, disse o autor da pesquisa Christopher Murray, da Universidade de Washington.
O cigarro matou 8 milhões em 2017 (Foto: Pixabay)Na média global, o consumo per capita de bebidas com açúcar é dez vezes superior ao recomendado, e o de sódio, 86% superior. Os indivíduos comem, em média, apenas 12% da quantidade recomendada de nozes e grãos. O consumo de carne vermelha é 18% superior ao considerado adequado.
No Brasil detectou-se uma deficiência de consumo de grãos e cereais integrais, assim como nos Estados Unidos, na Alemanha, na Nigéria, na Rússia e no Irã.  O estudo concluiu que as  mais associadas às mortes são aquelas com muito sódio e insuficiente ingestão de frutas, verduras, legumes, frutas secas e ômega-3. A ingestão de bebidas doces, açúcares, gorduras e carne vermelha têm menor influência.
Para os pesquisadores, portanto, “as mortes se associam mais com não comer suficientemente alimentos saudáveis do que com comer demais dos que são ruins para a saúde”.
Segundo os dados, das 11 milhões de mortes, 10 milhões foram por doenças cardiovasculares, 913 mil por câncer e 339 mil por diabetes tipo 2.
Manter uma dieta saudável e equilibrada não depende, no entanto, apenas da vontade pessoal. A pesquisa mostra que a desigualdade econômica influencia negativamente nas escolhas alimentares. Em média, chegar às porções de frutas e vegetais recomendadas pelos médicos (cinco por dia) custa apenas 2% da renda das famílias nos países ricos, mas mais da metade da renda familiar nos mais pobres.
A partir do estudo, os autores defendem que as autoridades devem se concentrar em impulsionar dietas equilibradas e o acesso a produtos saudáveis em vez de focar na restrição de alimentos menos saudáveis.
",Saúde,"Comer mal mata mais do que cigarro, diz estudo","Uma má dieta é fator de risco responsável pelo maior número de mortes no mundo, aponta trabalho publicado em The Lancet",2019-04-04 15:21:57
Ana Maria Oliveira e Gabriela Lenz de Lacerda,https://www.cartacapital.com.br/blogs/sororidade-em-pauta/ditadura-no-campo-a-memoria-da-violencia-contra-as-mulheres-camponesa/,"Esse anjo fragmentado indica que a história não é linear ou neutra.Para a coluna Sororidade em Pauta, Ana Oliveira vai contar um pouco sobre as mulheres camponesas, não raro esquecidas nessa narrativa de sucessivas violências. Das mulheres da cidade há farto material disponível, de muitas delas ouvi relatos contundentes que expõem a barbárie da tortura e seus algozes.Na foto, Lúcia Maria de Souza, conhecida como Sônia e Osvaldo Orlando da Costa, o famoso Osvaldão, ambos guerrilheiros no Araguaia.Livro Cativeiro sem Fim, de Eduardo Reina, conta a história de crianças sequestradas pela ditadura, desmontando um mito de que a ditadura brasileira não adotava essa prática como às vizinhas sul-americanas.Imagem destacada: mulheres que foram assassinadas na repressão à guerrilha do Araguaia. Jana Moroni, Helenira Rezende e Dinaelza Santana Coqueiro",Sororidade em Pauta,Ditadura no campo: a memória da violência contra as mulheres camponesa,Conselheira da Comissão de Anistia fala sobre a repressão e assassinato da ditadura às mulheres camponesas,2019-04-05 16:45:11
Deutsche Welle,https://www.cartacapital.com.br/politica/defensoria-publica-tenta-barrar-comemoracoes-do-golpe-de-1964/,"O pedido veio na forma de uma ação civil pública, protocolada nesta terça-feira 26, pedindo urgência na análise do tema.
    Na ação pública, a Defensoria afirma serem de conhecimento público os “horrores” vividos durante o período ditatorial, citando relatórios da Comissão da Verdade, dados sobre mortos, torturados e desaparecidos no período, que se estendeu de 1964 a 1985, e argumenta que comemorar a data e um regime que perseguiu, torturou e assassinou pessoas violaria a moralidade administrativa.
“Diante do alarmante quadro de violação de direitos humanos, em especial, violação aos princípios constitucionais e outros aos quais o Brasil aderiu no cenário internacional, não resta outra medida senão solicitar ao Poder Judiciário que interfira, exercendo sua função constitucional e seu papel maior no Estado Democrático de Direito”, diz a Defensoria.
Além disso, afirmou que exaltar o regime militar violaria a memória coletiva, estimulando “que novos golpes e rupturas democráticas ocorram”, atentando contra a democracia e contra o estado democrático de direito.  O AI-5 foi o golpe dentro do golpe (Foto: Arquivo Nacional)Uma eventual comemoração infringiria a Lei de número 12.345/2010, segundo a qual a proposição de datas comemorativas deve ser objeto de projeto de lei, acrescenta a ação.
“Caso o presidente decidisse instituir uma nova data comemorativa nacional seria necessário, no mínimo, uma convergência de vontades, respeitando o princípio da separação de poderes” previsto no Artigo 2 da Constituição.
A medida de Defensoria foi uma reação ao anúncio do porta-voz da Presidência, general Otávio Rêgo Barros, de que o presidente Jair Bolsonaro havia determinado ao Ministério da Defesa que sejam feitas comemorações em unidades militares aos 55 anos do golpe militar, já tendo aprovado a inclusão da data na ordem do dia das Forças Armadas.
A medida foi condenada pelo Ministério Público Federal (MPF). Segundo o órgão, a decisão “soa como apologia à prática de atrocidades massivas” e que a celebração de crimes por parte do Estado “atenta contra os mais básicos princípios da administração pública, o que pode caracterizar ato de improbidade administrativa”.
Em outra frente, o advogado Carlos Alexandre Klomfahs entrou com uma ação popular requerendo à Justiça que a Presidência se abstenha de celebrar a data, citando “ações do Executivo que extrapolam a moralidade administrativa”.  Por sua parte, o ministro da Defesa, general Fernando Azevedo e Silva, refutou o uso da palavra “comemoração” para se referir aos eventos que marcarão o dia 31 de março, mas afirmou que a data precisa ser lembrada e explicada aos mais jovens.
“O termo aí, comemoração, na esfera do militar, não é muito o caso. Vamos relembrar e marcar uma data histórica que o Brasil passou, com participação decisiva das Forças Armadas, como sempre foi feito. O governo passado pediu que não houvesse ordem do dia, este, ao contrário, acha que os mais jovens precisam saber o que aconteceu naquela data, naquela época”, disse o ministro, que está em Washington.
O presidente Jair Bolsonaro, durante comemoração dos 73 anos da Brigada de Infantaria Pára-quedistaApós a determinação do presidente, os eventos começaram a ser preparados pelos militares. Eles devem ocorrer na próxima sexta-feira, 29 de março, conforme consta na agenda do comandante do Exército, general Edson Leal Pujol. Uma cerimônia às 8h aparece como “solenidade comemorativa ao dia 31 de março de 1964” – contrariando a declaração de Azevedo e Silva de que “comemoração” não é o termo correto.
O período da ditadura, que se estendeu de 1964 a 1985, teve início com a derrubada do governo do então presidente democraticamente eleito, João Goulart, e foi marcado por censura à imprensa, fim das eleições diretas para presidente, fechamento do Congresso Nacional, tortura de dissidentes e cassação de direitos.
Bolsonaro sempre afirmou que o período de 21 anos não foi uma ditadura. Durante a votação do impeachment de Dilma, ele chegou a homenagear o coronel Carlos Alberto Brilhante Ustra, reconhecido pela Justiça de São Paulo como torturador durante o regime militar.
",Política,Defensoria Pública tenta barrar comemorações do golpe de 1964,"Órgão diz que celebrar início do regime ditatorial, como ordenado por Bolsonaro, violaria moralidade administrativa, memória coletiva e lei ",2019-03-27 13:46:12
Alexandre Putti,https://www.cartacapital.com.br/mundo/mortalidade-infantil-cresce-75-em-5-anos-na-venezuela/,"O estudo avaliou a situação da saúde no país de Nicolás Maduro, que sofre com uma crise política e humanitária. A equipe fez 156 entrevistas no período de 12 meses ouvindo médicos que atuam na Venezuela e cidadãos que cruzaram a fronteira do Brasil ou da Colômbia.
Desde 2017 não existe uma comunicação oficial do governo venezuelano sobre os dados da saúde do país. Para chegar aos números foram utilizadas pesquisas de órgãos internacionais que defendem os direitos humanos e as entrevistas realizadas pela equipe. Os médicos consultados também enviaram documentos.  
A conclusão não foi animadora: o estudo se deparou com um sistema de saúde em colapso total, aumentando os níveis de mortalidade materna e infantil; a propagação de doenças evitáveis ​​por vacinação, como o sarampo e a difteria; e o aumento no número de doenças infecciosas, como malária e tuberculose.
“Embora o governo tenha parado de publicar dados oficiais sobre nutrição em 2007, pesquisas realizadas por organizações e universidades venezuelanas documentam altos níveis de insegurança alimentar e desnutrição infantil, e dados disponíveis mostram altas admissões hospitalares de crianças desnutridas”, diz o relatório.  Sobre a mortalidade infantil foram utilizados dados da Unicef que mostram uma quase duplicação das taxas nos últimos cinco anos. De 14,6 mortes por 1.000 nascidos vivos em 2012 para 25,7 mortes por 1.000 nascidos vivos em 2017. Em um dos hospitais do país, a situação é ainda pior: de 2016 a 2018, as mortes neonatais aumentaram 54% e o número de mortes infantis dobrou.
A ajuda humanitária internacional à Venezuela teve crescimento em 2018, após uma mudança no discurso do governo de negar totalmente a crise humana e econômica. Maduro, entretanto, sustentou (e sustenta) que a escassez tem a ver com as sanções impostas pelos EUA. Organizações internacionais e não-governamentais têm relatado consistentemente que a ajuda à Venezuela não é suficiente para cobrir as necessidades urgentes da população.
Tamara Taraciuk é venezuelana radicada na Argentina e foi uma das responsáveis pelo estudo. Ela conta que a conclusão do relatório é de que a crise venezuelana é consequência de uma má gestão. “O governo de Nícolas Maduro esconde os dados para maquiar a magnitude da crise. Mais de 7 milhões de pessoas precisam de ajuda humanitária na Venezuela, precisamos agir”, disse.  
Segundo Tamara, o secretário-geral da ONU, António Guterres, deve liderar esforços para desenvolver um plano abrangente de resposta humanitária, dentro e fora do país. “Nada deve ser feito diretamente ao Estado. Toda a ajuda deve ser direcionada à ONU. Os países precisam agir, mas sem envolver a política”, pontua.
“A combinação de escassez de medicamentos e de alimentos, juntamente com a disseminação de doenças nas fronteiras da Venezuela, equivale a uma emergência humanitária complexa que requer uma resposta completa”, conclui Tamara.
Assista ao vídeo sobre a campanha:

",Mundo,Mortalidade infantil cresce 75% em 5 anos na Venezuela,O país comandado por Maduro é o único da América do Sul que retornou a níveis observados nos anos 90,2019-04-04 03:30:11
Giovanna Galvani,https://www.cartacapital.com.br/mundo/cartaexplica-entenda-as-origens-e-os-desafios-do-brexit/,"ontexto da Guerra Fria.O Reino Unido, em laranja, em relação ao restante dos países pertencentes à União Europeia, em azul. (Fonte: Wikimedia Commons)A decisão de sair foi tomada por meio de um referendo, realizado no dia 23 de junho de 2016. Basicamente, os ingleses foram às urnas para votarem pela permanência ou não do país no bloco.Pelo “sim”, votaram em maior parte os jovens e adultos até 50 anos, e os cidadãos residentes na Irlanda do Norte e da Escócia. Já a Inglaterra e o País de Gales tiveram maioria votante pelo “não”, assim como o voto da faixa mais velha da população. O resultado final foi apertado: Em laranja, os locais onde prevaleceu o voto pela permanência do Reino Unido na UE. Em azul, os votantes pela separação. (Fonte: Wikimedia Commons)Para o “não”, além da valorização da soberania britânica, estavam em discussão a crise dos refugiados e a entrada de imigrantes no Reino Unido, a disparidade econômica dentro do bloco – com a ideia de que a UE “sustenta” países mais pobres, como no caso da crise na Grécia no início da década, e sai perdendo com isso -, e promessas de maior investimento em serviços básicos, como a saúde.Pelo “sim”, os cidadãos posicionavam-se pela mesma questão econômica, mas visando os impactos futuros – desde multas aplicadas pelo Parlamento europeu para a saída formal, até a dependência que o RU tem do amplo mercado da Europa, que passaria a cobrar taxas alfandegárias novamente -, o intercâmbio cultural e científico amplificado, e maiores oportunidades de empregos fora dos domínios da rainha.A decisão pela saída foi uma surpresa até para quem convocou o referendo, o então primeiro ministro David Cameron. Esperando pelo resultado contrário, Cameron renunciou ao cargo no dia seguinte à aprovação do Brexit.No seu lugar, a atual premiê Theresa May, do Partido Conservador, foi a responsável por toda a articulação da saída, que envolvia articular um acordo menos prejudicial possível aos ingleses, que deveria ser avaliado pela União Europeia e pelo Parlamento britânico.Após quase 2 anos de negociação sobre os termos da separação, May conseguiu aprovar, em 25 de novembro de 2018, o chamado “acordo de retirada” com a UE. Entre os tópicos mais importantes, estavam:No cenário ideal, que envolvia a aprovação do acordo pelo Parlamento inglês, 29 de março seria o dia derradeiro do Reino Unido como parte da Comunidade Europeia.Theresa May, no entanto, encontrou uma enorme resistência dos parlamentares ingleses, que se posicionaram contrários ao acordo aprovado. Em janeiro de 2019, ele foi rejeitado em uma votação histórica que marcou a maior derrota do governo em quase 100 anos: foram 432 votos contra e 202 a favor.Entre as principais polêmicas, estava a questão fronteiriça da Irlanda com a Irlanda do Norte, e a opinião de parlamentares que, de um lado mais radical, defendem uma quebra brusca de relações com a UE, e, do outro, são contrários ao Brexit e contam com manifestações em peso da população para reiterarem sua posição.A britânica, Theresa May, em sessão da segunda derrota do acordo pelo Brexit. (Foto: Mark Duffy/AFP)Na visão da premiê, um processo gradual seria menos danoso à economia britânica, e daria tempo para os dois lados construírem novamente relações diplomáticas de qualidade. “Uma saída sem acordo significaria nenhuma parceria de segurança com a União Europeia”, disse May no seu discurso antes da primeira votação.O apelo, no entanto, não surtiu efeito: o acordo foi rejeitado mais duas vezes, nos dias 12 e 29 de março. Depois da segunda rejeição, a União Europeia concordou em conceder mais tempo para a saída definitiva, que deve ser feita até o dia 12 de abril se o Parlamento se recusar a aprovar o acordo de May. Caso contrário, a Grã Bretanha pode respirar para sair até o dia 22 de maio.Encurralada, a primeira ministra chegou a anunciar a sua renúncia caso os parlamentares votassem pela aprovação, entendendo que seus baixíssimos níveis de popularidade não permitiriam que ela permanecesse no cargo por muito tempo depois da finalização do Brexit.Segundo vários jornais britânicos, Downing Street – a sede do Governo – planeja propor aos deputados uma única escolha: ou votam no acordo de May ou em um projeto alternativo com um Brexit mais suave que o texto atual (proposta que pretende angariar o apoio dos deputados moderados). O texto, no entanto, voltaria para análise do parlamento europeu, que já se mostra incomodado com o imbróglio.A chefe de Governo espera convencer os eurocéticos de seu partido conservador a votarem pelo acordo já aprovado. Sem ele, um “no deal” (saída sem acordo) em 12 de abril, suposição que preocupa os meios econômicos, continua a ser o cenário mais provável. *Com AFP.",Mundo,CartaExplica: Entenda as origens e os desafios do Brexit,"Do casamento até o divórcio, entenda o caminho para a saída do Reino Unido da União Europeia",2019-04-03 03:30:44
