author,url,text,section,title,sub_title,date
RFI,https://www.cartacapital.com.br/mundo/onu-condena-codigo-penal-do-brunei-que-institui-morte-a-pedradas/,"Em entrevista à , a porta-voz do Alto Comissariado da ONU para os Direitos Humanos, Ravina Shamdasani, disse que pedirá ao governo do Brunei, pequeno sultanato situado no sudeste asiático, a revisão do novo Código Penal.
Segundo ela, penas como essa, aplicadas atualmente, são “cruéis e desumanas e violam gravemente o direito internacional e os direitos humanos. Este é, por exemplo, o caso da morte por lapidação, que deve entrar em vigor na quarta-feira 3 e estipula a pena de morte para estupro, adultério, relações sexuais extraconjugais para os muçulmanos, sodomia, roubo ou insulto ou difamação ao profeta Maomé”, explicou a Shamdasani.
A nova lei também criminaliza a exposição dos meninos muçulmanos a outras religiões e ordena a amputação de uma mão ou um pé por roubo ou a lapidação pública como punição para o aborto. O pedido da ONU acontece depois que o ator americano  convocou um boicote a nove hotéis de luxo vinculados ao sultão de Brunei. Sua convocação foi apoiada por personalidades políticas ou artísticas de diversas tendências, mesmo entre as mais conservadoras.  A pena de morte está prevista na legislação de Brunei, mas a última execução remonta a 1957, segundo a ONU. “Peço a Brunei que mantenha sua moratória de fato sobre a aplicação da pena de morte”, escreveu, em um comunicado, a Alta Comissária da ONU para os Direitos Humanos, Michelle Bachelet.
A pequena monarquia de 430 mil habitantes é dirigida com mão de ferro pelo sultão Hasanal Bolkiah desde 1967. O Sultanato anunciou a introdução progressiva da sharia, a lei muçulmana, pela primeira vez em 2013. A aplicação foi adiada para que os oficiais resolvessem a oposição de organizações de direitos humanos.
",Mundo,"ONU condena Código Penal do Brunei, que institui morte a pedradas",As novas penas atingem em particular homossexuais e adúlteros,2019-04-03 17:54:53
Redação,https://www.cartacapital.com.br/politica/em-nova-pesquisa-aprovacao-de-bolsonaro-cai-ainda-mais-e-vai-a-35/,"A avaliação da população sobre o desempenho do presidente Jair Bolsonaro (PSL) está em franca queda. Segundo a pesquisa divulgada nesta sexta-feira 5 pela XP Investimentos, 35% aprovam o presidente.Segundo o levantamento, realizado de 1 a 3 de abril, as curvas de aprovação e reprovação mostram nitidamente uma trajetória ruim para Bolsonaro a partir de fevereiro, quando era aprovado por 40% dos que responderam à pesquisa da XP. Depois, em março, oscilou para 37%. Agora, está em 35%.  Na mesma medida, a reprovação a Bolsonaro só aumenta. Em fevereiro, o índice era de 17%, passando a 24% em março. Em abril, atingiu 26%, oscilação dentro da margem de erro, mas que confirma a trajetória de alta no indicador. A proporção dos que consideram o governo regular, 32%, se manteve entre março e abril. A margem de erro é de 3,2 pontos percentuais.  A pesquisa também analisou outros indicadores: as instituições que desfrutam da menor confiança ainda são os partidos políticos. Cerca de 89% dizem não confiar neles. Em oposição, as Forças Armadas são a instituição com o maior nível de confiança: 66% dizem que podem confiar nelas.  : oscilou 3 pontos para baixo a percepção da população de que a reforma é necessária, embora a maior parte continue defendendo a mudança. Em março, 64% concordavam com a afirmação de que é preciso fazer uma reforma da Previdência. Em abril, eram 61%.55% dos entrevistados responderam que o Brasil vive uma “nova política”. Do outro lado, 39% não concordam com essa interpretação.",Política,"Em nova pesquisa, aprovação de Bolsonaro cai ainda mais e vai a 35%","Levantamento da XP mostra que a trajetória vem caindo desde fevereiro, quando o trabalho do presidente era aprovado por 40% da população",2019-04-05 12:56:34
Fernanda Orsomarzo,https://www.cartacapital.com.br/opiniao/independencia-funcional-ou-morte/,"







  
Dentre os pressupostos do regime democrático inaugurado pela Constituição de 1988, tem-se a previsão de uma magistratura independente e imparcial. Ora, sendo o Poder Judiciário guardião último dos direitos e garantias fundamentais, revela-se de especial importância que seus membros sejam independentes em suas convicções, assegurando-se o acesso do cidadão a uma ordem jurídica justa, imune a eventuais pressões ou interesses externos.
Portanto, a garantia de independência do Poder Judiciário não constituiu privilégio dos juízes, mas prerrogativa popular. Noutras palavras, a decisão devidamente fundamentada com base na convicção do magistrado da causa e em observância às obrigações inerentes ao cargo deve ser respeitada enquanto conquista democrática, o que não impede sua revisão por meio de recurso próprio. Violar a autonomia do julgador em dizer o direito ao caso concreto significa violar o próprio Estado Democrático de Direito.
Não há como aceitar que a judicatura seja intimidada pelo raso discurso do senso comum, incapaz de perceber que no mundo real a lógica simplista “bem x mal” não é suficiente para a resolução de conflitos. O julgar, quando feito com responsabilidade e maturidade, extravasa essa noção. A vida é complexa e demanda a análise de inúmeras circunstâncias e particularidades, não sendo possível encaixar indivíduos em módulos pré-concebidos e fabricados de acordo com uma única visão de mundo.
Ministro Celso de Mello

Após quase cinco anos de magistratura, constato que poucas foram as vezes em que dúvidas não acompanharam meu dia-a-dia. Elas – as dúvidas – me perseguem durante todo o tempo, aparecendo, acreditem, até mesmo em sonho. A responsabilidade do julgar o próximo pesa nos ombros e demanda reflexão constante. Durmo com muitas dúvidas sobre a melhor forma de dizer o direito em casos que aguardam minha análise. Mas jamais durmo com medo. O dia em que sentir receio do julgar, a magistratura estará morta em mim.
",Opinião,Independência funcional ou morte,São constantes os episódios envolvendo ataques pessoais quando a decisão prolatada destoa do que o clamor popular espera,2019-04-03 13:15:55
Érika Puppim,https://www.cartacapital.com.br/opiniao/do-golpe-de-1964-a-2019-permanencia-das-violacoes-de-ontem-e-de-hoje/," 
A onda conservadora, militarista, religiosa e reacionária que atingiu o Brasil e culminou na eleição de Jair Bolsonaro, trouxe ao debate público uma mácula da história brasileira: a ditadura militar.
Na polarização que se instaurou no país, para manter sua popularidade e a fidelidade de seu eleitorado, o Governo Federal surfa na onda que o elegeu: a pauta moral-ideológica. Afinal, provar a competência de seu governo pelos aspectos da reforma da previdência, geração de emprego, saúde, educação e ausência de traços de corrupção tem se mostrado tarefa árdua.
Assim, o Presidente determinou, por meio de seu porta-voz, que o Ministério da Defesa fizesse “comemorações devidas” aos 55 anos do golpe que instalou a ditadura militar no Brasil.  Não satisfeito em se restringir ao meio institucional-militar, Bolsonaro utilizou ainda de instrumento mais amplo que o impulsionou durante a campanha eleitoral, o “WhatsApp”, por meio do canal oficial do Palácio do Planalto, divulgando vídeo em que afirma que o Brasil viveu um tempo obscuro que se deu em razão “daquilo que os comunistas faziam, prendiam e matavam seus compatriotas”, sem obviamente citar nenhuma fonte, e então, conclamado pelo povo nas ruas, mas “o povo de verdade, pais, mães e a igreja”, o Brasil lembrou que tem um Exército Nacional e “graças a Deus, fez-se luz e o Exército nos salvou!”.
Ato em 2016 em memória de mulheres vítimas da ditadura. Foto: Tania Rego/Agência BrasilChama a atenção o nítido revisionismo histórico empregado no vídeo para demonizar uma suposta ameaça comunista que justificaria, “sob a benção de Deus”, todo tipo de tortura, humilhação, dor, exílios, desaparecimentos forçados, estupros, prisões arbitrárias, separação de mães, pais e filhos e execuções praticadas pelas Forças Militares, apesar dessas e outras violações de direitos humanos terem sido reconhecidas internacionalmente pela Corte Interamericana de Direitos Humanos, pelas quais o Estado Brasileiro já foi condenado duas vezes.
Esse revisionismo histórico leva ao ideário das Forças Armadas como verdadeira salvadora da pátria, responsável por nos livrar da amedrontadora ameaça comunista, como na velha premissa maquiavélica de que “os fins justificam os meios”.O fato é que desde o Golpe de 1964, o qual recebeu amplo apoio civil, empresarial, religioso e midiático, a sociedade brasileira não alcançou um consenso da Ditadura Militar como período de exceção e de violação de direitos humanos.
Mesmo após a redemocratização, não se falou abertamente sobre as atrocidades em massa cometidas pelo regime castrense e não se construiu uma memória sobre a verdade dos anos sombrios da ditadura.  Para que um país aprenda com seus erros históricos em períodos de exceção, é preciso que se institua uma “Justiça de Transição” na qual se reconheça e articule os elementos da Verdade, Memória, Justiça e Reparação.
No entanto, passamos à democracia em 1988 tentando colocar uma “pedra” em cima dos anos de chumbo, como se isso bastasse para ir adiante. A verdade foi ocultada, a memória apagada e a Justiça, não realizada.
Em que pese o trabalho louvável de todos os envolvidos na Comissão da Verdade (CNV), instituída pela Lei 12.528/2011, a qual objetivou o resgate da memória e da verdade sobre as graves as violações de direitos humanos praticadas entre 1946 e 1988, e resultou na publicação de seu primoroso relatório em três volumes, o que se verifica na prática é que não houve uma forma efetiva de Justiça de Transição no Brasil, que trouxesse uma cultura de memória e reconhecimento social do período militar como regime de exceção.
Portanto, o elemento “Justiça”, entendido aqui como a investigação, processamento e julgamento daqueles que perpetraram torturas, execuções e outras violações de direitos humanos, não se concretizou visto que nossa Lei de Anistia (Lei nº 6.683/79) afastou a responsabilidade dos militares, sendo considerada uma “anistia de duas vias”, interpretação esta confirmada pelo STF na ADPF 153, na qual se afirmou que o caso brasileiro era de uma “anistia recíproca”, resultante de um “acordo” – como se fosse possível opositores de um regime autoritário negociarem em igualdade de condições com este.
Desta forma, apesar da nossa Constituição de 1988 se apresentar progressista e garantista de direitos fundamentais, iniciamos a transição para uma democracia calcada nas violações praticadas em um regime militar ditatorial sem rever suas ilegalidades.  A reforma institucional que se espera de um Estado Democrático em sua transição após um regime autoritário e repressivo não ocorreu no Brasil, eis que se manteve a mesma estrutura estatal, inclusive a polícia militar, que continuou perpetrando as violações de outrora de forma sistemática, não mais voltadas aos “subversivos” de antes, mas àqueles que hoje superlotam os presídios.
Enquanto a repressão salvadora nos libertava de um suposto regime comunista, hoje ela é aplaudida para nos livrar de uma criminalidade assustadora, em que se fala de uma “guerra” do bem contra o mal, o “nós” contra “eles”.
A mesma legitimação social a qual embasou o regime castrense para torturar, executar e desaparecer é mesma que hoje aplaude execuções sumárias (como no caso dos cinco jovens fuzilados em um carro em Costa Barros), torturas (como no Cláudia Silva Ferreira que foi arrastada por uma viatura da PM até a morte) e desaparecimentos (como no caso do pedreiro Amarildo), apenas para elencar alguns casos noticiados pela grande mídia.
Todos esses crimes são justificados pelo medo da crescente criminalidade, em que pessoas de determinada cor e classe social, são eleitas como inimigas dentro da lógica militar de guerra, “os bandidos”, cuja pena de morte sumária é socialmente aceita.
Outro caso conhecido de execução policial foi o do vídeo que flagrou dois policiais militares do 41º BPM (Irajá) executando dois suspeitos já abatidos ao chão, sem oferecer resistência, em Acari, Zona Norte do Rio, em março de 2017, ocasião em que a menina Maira Eduarda morreu de “bala perdida” (ou achada?).
Na decisão que concedeu liberdade provisória aos policiais, o juiz recorreu ao discurso de guerra e à aceitação social, chamada de “voz das ruas”:
“A sociedade não suporta mais tanta violência. Mas não é o clamor de resultado gravoso e trágico, sempre presente em situações de guerra, que pode nos seduzir para afastar a incidência da lei. Não há ordem pública sem credibilidade da Justiça e não há credibilidade sem observância das normas legais atinentes, sem análise isenta e equilibrada dos fatos. Meditei muito sobre cada detalhe deste procedimento. Ponderei especialmente sobre a voz das ruas”.
Essa naturalização da tortura e da execução sob a justificativa de que “vivemos uma guerra”, faz com que a promessa de campanha do atual Presidente da República seja a legítima defesa presumida para execuções policiais, como consta do projeto “Anticrime”, pelo qual o policial estará isento de pena por excesso na legítima defesa se esta “
Sobre a lógica de repetição das violações nos dias de hoje, vale citar o trecho de artigo publicado na revista do Ministério Público Federal 

Conclui-se que a perpetuação das violações de direitos humanos ocorridas na ditadura militar e a persistência do legado autoritário, com ampla legitimação social, continuam impondo barreiras ao aprofundamento democrático, tal como uma ferida aberta na história brasileira, ainda longe cicatrizar.
Imagem destacada: Ato em 2016 no Rio de Janeiro em memória das mulheres vítimas da ditadura. Foto: Tânia Rego/Agência Brasil
",Opinião,Do Golpe de 1964 a 2019: permanência das violações de ontem e de hoje,"Promotora de Justiça no MP-RJ, Erika Puppim lança luzes sobre a obscura comemoração do golpe de 1964 pelo governo atual",2019-04-04 15:24:08
VALDETE SOUTO SEVERO,https://www.cartacapital.com.br/opiniao/o-que-e-isso-reforma-da-previdencia/,,Opinião,O que é isso: “Reforma” da Previdência?,"Como no Chile de Pinochet, a verdadeira alteração das regras da previdência é a mudança do sistema de solidariedade para o de capitalização.",2019-04-02 18:35:53
Carol Scorce,https://www.cartacapital.com.br/diversidade/chicago-elege-a-primeira-prefeita-negra-e-lesbica/,"A partir de 20 de maio, a terceira maior cidade dos Estados Unidos, Chicago, será administrada por uma mulher negra e lésbica, a primeira na história do país. A ex-promotora federal Lori Lightfoot, de 56 anos, derrotou na terça-feira 2 Toni Preckwinkle.
A ex-procuradora federal, que nunca antes havia disputado um cargo eletivo, conseguiu 74% dos votos contra os 26% de Toni Preckwinkle, também negra e lésbica. “Vocês não se limitaram a fazer história, criaram um movimento de mudança”, disse Lightfoot a centenas de apoiadores. Preckwinkle manifestou o seu apoio à também democrata: “Trata-se de seguir o caminho em frente”.
Lightfoot nunca ocupou um cargo político, enquanto Preckwinkle, de 72 anos, foi vereadora da cidade durante quase duas décadas antes de se tornar presidente do conselho de Cook County em 2010. A prefeita eleita promete acabar com a corrupção e tornar as ruas da cidade novamente seguras. “Podemos e vamos reconstruir Chicago”, afirmou.
Nos Estados Unidos, apenas 6% dos presidentes de Câmara (prefeitos e prefeitas) nas 200 maiores cidades americanas são mulheres negras, de acordo com a plataforma Reflective Democracy Campaign, citada pela agência de notícias .
Lightfoot e Preckwinkle, ambas democratas, foram ao segundo turno das eleições depois de conseguirem as melhores votações entre os 14 candidatos nas eleições de fevereiro. Lightfoot substituirá Rahm Emanuel, que não se candidatou a um terceiro mandato na Câmara.
A recém-eleita, ex-presidente do corpo civil independente do Conselho da Polícia de Chicago, herda enormes desafios fiscais. Entre eles encontra-se um passivo não capitalizado de 28 milhões de dólares (cerca de 25 milhões de euros) dos quatro sistemas de reforma na cidade, além de uma crescente contribuição anual para o fundo de pensões que irá atingir os 2 milhões de dólares (1,8 milhão de euros) em 2023, sintetiza a Reuters.
Lightfoot também terá de lidar com um défict orçamental estimado em 252 milhões de dólares (225 milhões de euros) para o ano fiscal de 2020, juntamente com contratos de trabalho com sindicatos da polícia, bombeiros e professores que já expiraram ou estão em vias de expirar.  A nova prefeita não vai ter descanso se quiser mesmo resolver os problemas da cidade de quase 3 milhões de habitantes. Chicago é campeã em homicídios nos Estados Unidos, com cerca de 540 assassinatos por ano. Apesar de os homicídios em Chicago terem diminuído no ano passado, menos de um em cada cinco ficou resolvido.
Também é uma das cidades americanas com maior disparidade econômica e social entre os grupos raciais. Brancos, negros e latinos têm praticamente a mesma representação demográfica na cidade. Cada um desses grupos representa cerca de 30% da população, mas os negros e os latinos ainda vivem como minorias em Chicago, pois não contam com as mesmas perspectivas socioeconômicas dos brancos.
Preckwinkle ofereceu o seu apoio à rival vitoriosa. “Não há muito tempo, duas mulheres afroamericanas a disputarem este lugar seria impensável. Embora possa ser verdade que tomámos caminhos diferentes para aqui chegar, esta noite trata-se de seguir o caminho em frente”, disse.
As duas candidatas, ambas da ala esquerda dos democratas, competiram com programas reformistas progressistas e promessas de fazer uma limpeza no governo da cidade e reduzir as desigualdades econômicas.
Com informações da Deutsche Welle e RFI
",Diversidade,Chicago elege a primeira prefeita negra e lésbica,"Lori Lightfoot, ex-promotora federal, venceu Toni Preckwinkle, também afro-americana, e irá governar uma das cidades mais violentas dos EUA",2019-04-03 14:26:49
Alexandre Putti,https://www.cartacapital.com.br/politica/bolsonaro-diz-nao-ter-duvidas-de-que-nazismo-e-movimento-de-esquerda/,"O que o presidente parece não saber, ou ao menos não se atentou, é que a própria instituição a qual ele visitou afirma que o nazismo foi um resultado do radicalismo de extrema direita. Em seu site, a instituição traz um breve histórico sobre a ascensão do partido nazista na Alemanha entre guerras.
Bolsonaro participa da cerimônia de oferenda floral, no Centro Mundial de Memória do Holocausto (Foto: Gali Tibbon/ AFP)Na semana passada, o ministro das Relações Exteriores, Ernesto Araújo, deu uma declaração que ganhou força nas redes sociais. O chanceler atribuiu o nazismo e o fascismo à esquerda. “Uma coisa que eu falo muito é dessa tendência da esquerda de pegar uma coisa boa, sequestrar, perverter e transformar numa coisa ruim. É mais ou menos o que aconteceu sempre com esses regimes totalitários. Isso tem a ver com o que eu digo que fascismo e nazismo são fenômenos de esquerda”, destacou Araújo, na entrevista divulgada pelo site .
A estratégia de tentar classificar o nazismo como uma ideologia de esquerda não é nova e chegou a ocorrer no passado em vários países. Mas nunca chegou a virar um debate sério entre especialistas.  Na Alemanha, durante as pesquisas e debates sobre o Terceiro Reich, iniciados nos anos 1960, chegou a haver tentativas de classificar o regime como um movimento socialista. No entanto, há décadas não restam dúvidas, seja no âmbito acadêmico, social ou político, sobre a natureza de extrema direita do nazismo.
O debate sobre o nazismo como uma ideologia de esquerda foi levantado no Brasil a partir dos anos 2000 por Olavo de Carvalho. A visão rapidamente se espalhou por páginas brasileiras de direita na internet, ganhando adesão também entre contas de viés liberal que adotaram posições conservadoras. Entre os adeptos está o deputado Eduardo Bolsonaro, filho do presidente da República e atual presidente da Comissão de Relações Exteriores da Câmara.
No País, os atuais defensores da visão “nazismo de esquerda” costumam se basear no nome oficial da agremiação nazista, chamada de Partido Nacional-Socialista dos Trabalhadores Alemães, ou NSDAP. A presença da palavra “socialista” revelaria a linha ideológica do regime. Historiadores internacionais de renome, porém, destacam que essa nomenclatura e a inclusão de políticas tidas como de esquerda no programa de governo apresentado antes das eleições de 1933 não passaram de uma estratégia eleitoral para atrair a classe trabalhadora.
O historiador Wulf Kansteiner, da Universidade de Aarhus, deixa claro que os nazistas jamais seguiram políticas de esquerda. “Ao contrário, propagavam valores da extrema direita, um extremo nacionalismo, um extremo antissemitismo e um extremo racismo. Nenhum especialista sério considera hoje o nazismo de alguma forma um fenômeno de esquerda. Por isso, da perspectiva acadêmica histórica, essa declaração é uma asneira”, afirma.  Segundo Kansteiner, tanto o entrevistador quanto o ministro jogam com a palavra “totalitarismo” e, durante sua argumentação, Araújo tenta com ela traçar uma fronteira entre o nacionalismo, que seria algo bom, e o socialismo, que seria algo ruim. “Historicamente isso é um disparate”, ressalta o especialista, que também é autor do livro (Em busca da memória alemã, em tradução livre).
Peter Carrier, coordenador de um projeto de pesquisa da Unesco sobre o ensino do Holocausto, promovido pelo Instituto alemão Georg Eckert, acrescenta que o ministro comete erros ao fazer referências à teoria do totalitarismo.
“Se Araújo tivesse lido precisamente os teóricos do totalitarismo e fosse fiel a suas teses, ele deveria condenar tanto a direita quanto a esquerda, pois o totalitarismo implica que regimes autoritários de direita e de esquerda são igualmente ruins”, afirma.
 
",Política,Bolsonaro diz “não ter dúvidas” de que nazismo é movimento de esquerda,"A declaração foi feita após o presidente visitar o Yad Vashem, Centro de Memória do Holocausto em Jerusalém ",2019-04-02 19:13:40
