author,url,text,section,title,sub_title,date
Joanna Burigo,https://www.cartacapital.com.br/diversidade/o-que-o-patriarcado-nos-ensina-sobre-as-mentiras-de-bolsonaro/,"A matéria sobre as declarações estapafúrdias do  acerca da localização político-ideológica do nazismo foi publicada antes mesmo que o presidente Jair Bolsonaro contundentemente confirmasse o delírio, e situa a origem da vazia polêmica na produção de .
Quando publiquei o termo pela primeira vez, ainda em 2016, expliquei que se  é a palavra que conceitua o emprego de práticas políticas coercitivas,  seria um desdobramento adequado para a política institucional dos nossos tempos e pagos, já temperada na mistura do mal com atraso e pitadas de psicopatia, e sendo forjada pelo desligamento proposital com qualquer traço de realidade.
São de conhecimento público algumas das técnicas características desta fase do acirramento acelerado de um projeto transnacional de poder, que soa como fascismo e tem forma de . Falo de coisas como análise de  aplicada ao emprego das redes sociais para pulverização personalizada de  e , por exemplo. Soa sofisticado, e é mesmo, porém, os termos não deixam de ser uma “gourmetização” das boas e velhas e .
Agindo conforme o legado do gênio da propaganda nazista Joseph Goebbels, muitos dos corpos masculinos e brancos correntemente (e constantemente, e nunca não) ocupando os assentos mais valiosos da política institucional vêm manipulando opinião pública com a repetição de mentiras até que estas se tornem verdades. Esta é uma tática tão velha como parafrasear Nietzsche dizendo que tudo está sujeito a interpretação, e que a que prevalece resulta do poder e não da realidade.  Uma forma notória que o poder tem de manipular e mentir para impor verdades é a propaganda, este termo técnico da teoria da comunicação que nomeia o conjunto de dispositivos simbólicos que implantam ideais como discurso.
Política é disputa, o material da política é o simbólico, e na  estão em jogo sobretudo significados., kit gay e mamadeira de piroca foram apenas três das muitas mentiras que fomentaram o sem-fim de  que sustentaram e ainda sustentam a  em que estamos metidos desde antes que qualquer ideal de democracia tenha sido triturado pela institucionalização, e por eleição, de sujeitos que se valem de mitologia patriarcal para estarem no poder. Terra plana, vacinas causando autismo, globalismo, a doutrinação marxista nas escolas – claramente um resultado do comunismo no Brasil, onde tampouco houve uma ditadura militar – aquecimento global ser invenção, ciência e opinião terem o mesmo valor: foram muitas as mentiras que precederam e moldaram nosso atual estado de coisas.
Bolsonaro parece ainda estar em campanha. Não assume a responsabilidade básica de um chefe de estado, que é governar para todo povo, e ao invés disso fomenta animosidade nas redes sociais entre brasis fabricados. Parece presidente de mentirinha, e mentir ele mente:  que ele deu 132 declarações falsas ou distorcidas nos três primeiros meses de governo.
Não abraço a narrativa de que estamos passando vergonha internacionalmente, não por isso não ser verdade, nem porque não somos os únicos (, mas porque vergonha é o sentimento mais irrelevante que me atravessa nestes tempos em que a catástrofe  é generalizada e veloz. Um salve, então, para nossa competência em fazer a narrativa ao menos soar tragicômica, como no 1º de abril, quando uma das  do Twitter nacional era.  Bolsonaro não mente, no entanto, sobre sua devoção ao mentor , outro mentiroso e . O mesmo Donald Trump que, num passado não tão distante, exigiu publicamente um certificado de nascimento de Barack Obama, esta semana mentiu descaradamente ao dizer que o pai, cria do Bronx, nasceu na Alemanha.
. Podem ser psicopatas ou narcisistas, mas este diagnóstico deixo para especialistas. O que se pode ver, por estar patente como técnica, é a propaganda que empregam para desestabilizar consensos sobre a realidade. Este tipo de tática é comum às instituições patriarcais, precede a , e nem sempre é lida como propaganda – mas minha hipótese é de que é assim que se dá a difusão de valores patriarcais.
A construção narrativa da bruxa, para dar apenas um exemplo, eclipsou a realidade destas serem mulheres independentes e detentoras de saberes medicinais e agrícolas com, digamos,  medievais sobre seres diabólicos operando forças ocultas. E é próprio do pensamento feminista tratar a heterossexualidade e a monogamia não como naturais nem essenciais, mas como criações culturais para a manutenção do poder dos homens, ambas como garantia da manutenção da propriedade pela garantia genética. (E aqui me sinto compelida a fazer uma ressalva: por serem construções culturais, é escorregadio discuti-las pelo viés do desejo, onde são tão válidas quanto outros arranjos de sexualidade consentida e organizações individuais de vida e afeto, mas isso abre outra conversa.)
A base da assim como a base do patriarcado, é fantasiosa. A sustentação de ambos não requer compromisso com a realidade. Pelo contrário: é absolutamente indispensável algum desligamento dela.
Mentiras e manipulação sobre quem vive realidades diferentes de qualquer que seja a narrativa de interesse do poder são excelentes modos de justificar sua aniquilação.Se a narrativa é fantasiosa, é compreensível que mentiras e manipulação sejam fundamentais para sua manutenção. Existe uma lógica aí. É perversa, mas é uma lógica. Por exemplo, se a fantasia é que “lugar de mulher é no lar”, a mentira naturalizada é de que a culpa é dela se sofrer consequências de não estar no lar. Se a bruxa é maligna, fica justificado livrarmo-nos delas. Se o nazismo é de esquerda, tudo bem aniquilar esquerdistas.
O absurdo argumento de que nazismo é de esquerda é como a fantasiosa sugestão de que bruxas voam em vassouras: são proferidas como discurso oficial para efeitos de manipulação da realidade. É surrealismo, e como o surrealismo tende a ser, é fabricado.
Na , tanto ou mais do que disputar verdades sobre sentidos, é importante compreender os jogos onde o sentido é a própria essência da disputa. Alguns jogos não se jogam. Mais vale revelar seus tabuleiros, identificar seus  e interceptar suas regras injustas. Por enquanto eles venceram. Mas o sinal não está fechado para abrirmos o jogo.
",Diversidade,O que o patriarcado nos ensina sobre as mentiras de Bolsonaro,"Se a narrativa é fantasiosa, é compreensível que mentiras e manipulação sejam fundamentais para sua manutenção",2019-04-04 17:30:11
Padre Ticão,https://www.cartacapital.com.br/blogs/dialogos-da-fe/a-teologia-da-libertacao-esta-mais-atual-do-que-nunca/,"
A América Latina do período pós Concílio Vaticano II (1962-1965) e da Conferência Episcopal Latina Americana realizada em Medellín-Colômbia em 1968 assistiu ao nascimento de uma teologia essencialmente libertadora que trazia em sua essência, como condição sine qua non, para viver o Evangelho de Cristo, a opção preferencial pelos pobres e a defesa de seus direitos. Estamos nos referindo à .
Incompreendida – e por esta razão condenada por muitos -, a Teologia da Libertação engloba vária correntes de pensamento, que interpretam os ensinamentos de Jesus Cristo em termos de uma libertação das injustiças impostas aos mais pobres pelas condições econômicas, políticas e sociais determinadas pelo poder dominador.
Conquanto o movimento possua raízes anteriores, admite-se o ano de 1971 como seu marco inicial, dado por meio do livro “A Teologia da Libertação”, escrito pelo teólogo peruano Gustavo Gutierrez.  Não tardou para que os escritos do padre peruano se tornassem conhecidos em toda América Latina e reunisse em torno de si teólogos de renome: Jon Sobrino, Leônida Proaño, Juan Luís Segundo, Leonardo Boff, Frei Betto, além de bispos e cardeais como , Dom Waldir Calheiros, Dom Paulo Evaristo Arns e Dom Aloísio Lorscheider, entre outros.
A Teologia da Libertação trouxe para a Igreja um sopro novo de esperança, aproximando-a dos mais pobres e desprezados pelos regimes de governos, impostos pela força e total desrespeito aos homens e mulheres que gritavam por justiça e liberdade.
As opressões sofridas pelo povo pobre remontam aos primórdios da história humana. Na esfera da fé e dos registros bíblicos, tais como descritos no livro do Êxodo, observa-se, facilmente, as ações de Deus em prol da libertação de seu povo, das opressões impostas pelos poderosos faraós.
O Evangelho de Lucas em seu quarto capítulo apresenta o programa de toda atividade de Jesus quando ele aplica a si mesmo, a texto de Isaías 61, 1-2 que acabara de ler na Sinagoga de Nazaré, o qual anuncia a missão libertadora a ser realizada pelo Messias em favor dos pobres, assumindo-a no hoje concreto em que se encontra.
No Evangelho de Mateus, capítulo 23,  critica os intelectuais e os líderes da classe dominante, que transformam o saber em poder, agindo hipocritamente e oprimindo o povo.  Condena também os líderes religiosos que sustentam um sistema formalista e hipócrita que não respeita a liberdade dos filhos de Deus.
Nos dias atuais, nos deparamos com novas opressões impostas aos mais pobres e desvalidos por meio de reformas trabalhista e , dentre outras. O povo já oprimido e prisioneiro de um sistema cruel e desumano está em vias de ser condenado à prisão imposta pela miséria a qual será submetido, caso nenhuma ação contrária e libertadora seja impetrada.
A Teologia da Libertação, que nos ensinou a caminhar de mãos dadas na defesa dos direitos de cada um e de todos sob a luz do Evangelho – assim como tantos outros movimentos surgidos com o mesmo objetivo -, sofreu e continua a sofrer, ataques pejorativos violentos e disseminadores do ódio.
Com qual objetivo esses ataques são praticados? O que esperam alcançar com isso? Quem são os responsáveis? Estas são questões que devemos responder com propriedade e sabedoria ante as afirmações dos “hipócritas e fariseus”.
O povo de Deus nasceu para ser livre e feliz. Vivamos esta verdade com fé e coragem.
* 
",Diálogos da Fé,A Teologia da Libertação está mais atual do que nunca,O povo de Deus nasceu para ser livre e feliz. Vivamos esta verdade com fé e coragem ,2019-04-04 13:38:05
Deutsche Welle,https://www.cartacapital.com.br/politica/partidos-alemaes-condenam-fala-de-bolsonaro-sobre-nazismo/,"“Os nazistas já usavam conscientemente a distorção política como instrumento da sua propaganda fascista. O fato de Jair Bolsonaro se apoiar nesta mentira é um ultraje nojento às vítimas do nazismo”, afirmou a deputada Yasmin Fahimi, presidente do Grupo Parlamentar Teuto-Brasileiro no Bundestag (Parlamento alemão).A deputada do Partido Social-Democrata (SPD), legenda mais antiga da Alemanha, lembrou ainda que as primeiras vítimas nos porões de tortura nazistas foram os social-democratas e sindicalistas e destacou que o nazismo foi um regime de extrema direita, marcado pela desumanidade, pelo belicismo e por uma ideologia racista que custou a vida de milhões de pessoas.“Essas declarações difamam a memória das vítimas da violência nazista. Um movimento de esquerda luta pela liberdade e igualdade das pessoas, ou seja, justamente o contrário”, disse Fahimi, que faz parte da legenda que integra a coalizão que governa a Alemanha ao lado da União Democrata-Cristã (CDU), da chanceler federal Angela Merkel, e da União Social-Cristã (CSU).O porta-voz de política externa do Partido Verde, Omid Nouripour, também condenou as declarações de Bolsonaro e do ministro Araújo. “Isso é uma distorção e falsificação massiva da verdade histórica. A tentativa de desacreditar a esquerda com esse absurdo é uma manobra concertada internacionalmente pela extrema direita para desviar a atenção de sua política vazia, porém, desumana”, disse.O deputado ressaltou que o nome Partido Nacional-Socialista dos Trabalhadores Alemães, ou NSDAP, foi apenas uma estratégia para atrair a classe trabalhadora e classificou a legenda como a mais extremista de direita que já houve.Peter Weiss, da conservadora CDU, lembrou que o partido nazista em seu início tinha uma ala socialista, que progressivamente foi eliminada. “O nazismo não foi um ‘movimento de esquerda’, mas um movimento nacionalista,  e racista, que conduziu a uma catástrofe na Alemanha e Europa”, afirmou o deputado, que também faz parte do grupo parlamentar alemão responsável por cultivar as relações com o Congresso brasileiro.O deputado Gero Hocker, do Partido Liberal Democrático (FDP), disse que o Brasil tem problemas maiores do que um debate sobre a história alemã. “Em vez de fazer comparações históricas inadmissíveis, Bolsonaro deveria promover em seu gabinete a vigência das condições básicas legais confiáveis também para investidores estrangeiros em seu país, impulsionar a educação e cortar impostos para trabalhadores e empresários para, assim, atrair investidores e fortalecer o poder de compra”.O deputado, que também é membro Grupo Parlamentar Teuto-Brasileiro, argumentou ainda que todo sistema ditatorial, tanto os de direita quanto os de esquerda, combate a diversidade e abertura de uma sociedade, e em ambos os casos há restrições de liberdades econômicas e sociais. Desta maneira, as duas classificações apresentam características semelhantes. “Ao mesmo tempo, historicamente é inútil fazer uma relativização do sofrimento das ditaduras de esquerda e de direita por meio de uma comparação geral como a de Araújo”.Para o deputado Alexander Ulrich, da legenda A Esquerda, as declarações demonstram uma ignorância massiva ou são negação deliberada da história e política. “Isso é para um presidente, especialmente de um país grande como o Brasil, extremamente dramático e perigoso. Com essas declarações, Bolsonaro quer desacreditar a esquerda, no entanto, ele acaba apenas se ridicularizando”, acrescentou.Integrante do Grupo Parlamentar Teuto-Brasileiro, Ulrich destacou que a ideologia de extrema direita do nazismo não tem nenhuma relação com a ideologia democrática e solidária internacionalmente da esquerda. “Pelo contrário, vejo uma série de traços do nazismo na própria política de Bolsonaro. Ficaria surpreendido se ele descrevesse a si próprio como de esquerda”, afirmou.Já o deputado Martin Hess, da legenda populista de direita Alternativa para a Alemanha (AfD), disse que na Alemanha houve um debate no passado sobre essa tese sem que ela fosse incorporada no discurso e lembrou que Bolsonaro baseou sua declaração em argumentos do filósofo Olavo de Carvalho.“Nosso partido, se concentra em encontrar soluções para problemas atuais e ameaças à nossa segurança e ao nosso bem-estar. Assim, devemos deixar debates históricos para historiadores e filósofos”, acrescentou Hess, que também está no Grupo Parlamentar Teuto-Brasileiro.Questionado sobre os comentários, o porta-voz de Merkel, Steffen Seibert, preferiu não comentar as declarações de Bolsonaro, porém, afirmou que a posição do governo da Alemanha em relação ao nazismo é bastante conhecida e clara. “Há anos e décadas existe uma convicção muito sólida que nos sustenta e sustenta todo nosso país”, destacou.Na Alemanha, há um amplo consenso, nos âmbitos acadêmico, social e político, sobre a . A disputa sobre a classificação da ideologia nazista é inexistente entre historiadores renomados.No fim da viagem a Israel, Bolsonaro disse a jornalistas “não ter dúvidas” de que o nazismo foi um movimento de esquerda. A declaração foi feita após uma vista ao memorial Yad Vashem, em Jerusalém, um museu público em memória às vítimas do Holocausto. A própria instituição define o nazismo como um movimento de direita.O posicionamento do presidente ocorreu em meio à polêmica causada por declarações recentes de Araújo de que o nazismo teria sido um “fenômeno” de esquerda.  Com as alegações, a tese parece ter virado discurso oficial em Brasília.Em longa entrevista a um canal simpático à extrema direita no Youtube, o ministro repetiu um discurso que esteve em alta nas mídias sociais brasileiras durante as eleições, mas que jamais foi levado a sério por acadêmicos na Alemanha. A tese é tida como absurda e desonesta por acadêmicos e diplomatas europeus.Em Jerusalém, questionado na terça-feira se concordava com a afirmação de Araújo, Bolsonaro afirmou: “Não há dúvida. Partido Socialista… Como é que é? Da Alemanha. Partido Nacional-Socialista da Alemanha.”Os atuais defensores do “nazismo de esquerda” costumam se basear no nome oficial da agremiação nazista, o Partido Nacional-Socialista dos Trabalhadores Alemães, ou NSDAP. A presença da palavra “socialista” revelaria a linha ideológica do regime. Historiadores internacionais de renome, porém, destacam que isso não passou de uma estratégia eleitoral para atrair a classe trabalhadora.",Política,Partidos alemães condenam fala de Bolsonaro sobre nazismo,Distorção e falsificação da história e difamação da memória das vítimas foram algumas das reações de parlamentares à fala do presidente,2019-04-05 14:59:22
Thais Reis Oliveira,https://www.cartacapital.com.br/politica/lavagem-de-dinheiro-por-apartamento-torna-temer-reu-pela-terceira-vez/,"A denúncia havia sido oferecida há dois dias pelo Ministério Público Federal em São Paulo e está no bojo da Operação Descontaminação, que investiga desvios na Eletronuclear — e motivou a     De acordo com os procuradores, o apartamento de Maristela teve uma reforma de 1,6 milhão paga com dinheiro de propina da Engevix, por intermédio do Coronel Lima e de Maria Rita. A empresa teria se beneficiado de contratos com Angra III, em obras há 35 anos.
A Lava Jato afirma que as obras ocorreram entre 2013 e 2014 e foram bancadas com dinheiro de corrupção e desvios que teriam ocorrido entre 2012 e 2016. O caso tramitava no Supremo Tribunal Federal (STF) e foi remetido para São Paulo em janeiro, depois que Temer perdeu o foro especial ao deixar a Presidência.    É a terceira vez que Temer ganha um passe para o banco dos réus desde que foi preso. Há dois dias, o juiz Marcelo Bretas acatou duas denúncias do MPF do Rio de Janeiro contra o ex-presidente por corrupção, lavagem de dinheiro e peculato no caso da Eletronuclear.
No dia 28, a justiça de Brasília o tornou réu por corrupção passiva no caso da  A denúncia existe desde 2017, mas só se tornou ação penal depois que ele perdeu o foro especial.
",Política,Lavagem de dinheiro por apartamento torna Temer réu pela terceira vez,"Filha do ex-presidente, o coronel Lima e a esposa dele, Maria Rita Fratezi, também serão processados",2019-04-04 20:34:55
Alexandre Putti,https://www.cartacapital.com.br/politica/entenda-todos-os-passos-do-conflito-entre-maia-e-moro/,"A prisão dos membros do MDB aconteceu horas após uma rusga envolvendo o presidente da Câmara dos Deputados, Rodrigo Maia, e o ministro da Justiça, Sérgio Moro. Na noite de quarta-feira, Moro enviou uma mensagem cobrando agilidade de Maia na votação do pacote anticrime. A resposta ao juiz, ou “funcionário de Bolsonaro”, foi dado em tom duro. Houve ainda uma réplica.
Entre vários parlamentares corre a teoria de que a prisão do ex-presidente e de seu companheiro de partido foi uma forma de Moro pressionar Maia. Franco é sogro do presidente da Câmara.
Eugênio Aragão, que chefiou a pasta ocupada hoje por Sérgio Moro durante o governo Lula, . “Tudo que eles fazem tem . Justo quando o genro de um dos atingidos [pela prisão] começa a enfrentar publicamente o ex-chefe da operação, que agora está no governo? É, no mínimo, uma grande coincidência”, avalia.
    
A incursão no mundo político do juiz Sergio Moro tem sido mais atribulada do que supunham seus admiradores. Apresentado como superministro, garantidor da lisura, da transparência e da ordem, o homem que combateria no governo a corrupção e o crime organizado, Moro acumula derrotas e constrangimentos em menos de três meses no cargo.
O mais recente revés aconteceu nesta quinta. O “passa-moleque” do presidente da Câmara dos Deputados, Rodrigo Maia, lembrou o magistrado de sua real posição no governo. Em entrevista coletiva,  Maia enviou um recado ao ex-juiz dizendo que política não se resolve dessa maneira. “Eu acho que ele conhece pouco a política. Eu sou presidente da Câmara, ele é ministro, funcionário do presidente Bolsonaro. Ele está confundindo as bolas. Ele não é o presidente da República”, afirmou Maia.
  Antonio Cruz/ Agência Brasil
Moro ficou irritado com a decisão do presidente da Câmara em determinar a criação de um grupo de trabalho para analisar seu projeto anticrime. Na prática, Maia congelou a tramitação da proposta, pois a elaboração deste grupo tem o prazo de 90 dias para debater as matérias.
Maia lembrou que a prioridade do governo é a aprovação da Reforma da Previdência e que qualquer outro assunto deve ser postergado. Alguns outros parlamentares da base de Bolsonaro já vinham mostrando preocupação em enviar um projeto tão polêmico ao mesmo tempo que a reforma.
Moro rebateu o presidente da Câmara e disse que era possível, sim, debater os dois projetos ao mesmo tempo. “O povo brasileiro não aguenta mais. Essas questões sempre foram tratadas com respeito e cordialidade com o senhor Presidente da Câmara, esperando eu que o mesmo possa ocorrer com o projeto e com quem o propôs”, disse Moro.
Não bastasse o presidente da Câmara colocar o projeto de Moro para escanteio, ele também selecionou parlamentares que são críticos a sua proposta para participar da Comissão. Na quarta-feira 20, Maia indicou Marcelo Freixo (PSOL-RJ) e Paulo Teixeira (PT-SP) para integrarem o grupo de trabalho que vai analisar o pacote anticrime.
“Quero que esse grupo seja o lugar para ouvirmos a sociedade civil sobre o pacote do Moro. Tenho muita experiência na área, e eles reconhecem isso”, diz Freixo.
As críticas do presidente da Câmara não foram apenas a Moro. Maia desqualificou o projeto anticrime apresentado pelo ministro e disse que o texto é um cópia e cola de proposta sobre o mesmo tema que foi apresentada no passado pelo ex-ministro da justiça Alexandre de Moraes, hoje ministro no STF.
“Ele conversa com o presidente Bolsonaro e, se o presidente Bolsonaro quiser, ele conversa comigo. Eu fiz aquilo que eu acho correto. O projeto é importante, aliás, ele está copiando o projeto direto do ministro Alexandre de Moraes. É um copia e cola. Não tem nenhuma novidade, poucas novidades no projeto dele”, disse.  Mais tarde e mais calmo, Maia deu uma entrevista à  e afirmou que o “copia e cola” não era uma crítica e sim uma afirmação feita pelo próprio ministro . “O próprio Moro me disse que tinha copiado muitos artigos (do projeto de Moraes) é por isso que eu disse isso”. O presidente da Câmara contou que o próprio presidente Jair Bolsonaro havia pedido para ele prioridade total na previdência e que deixasse os outros projetos para depois.
Beto Barata/ PRMoro sempre foi protagonista nos processos da operação Lava Jato. Nesses cinco anos, o juiz ganhou fama no pais e vinha se comportando como um superstar da Justiça. Entrevistas, prêmios, coletivas e jantares faziam parte da rotina do magistrado.
Além disso, a imprensa sempre era avisada com antecedência sobre qualquer movimentação da operação. O presidente da Câmara ironizou o ministro e insinuou que Moro busca destaque na mídia ao querer aprovar a proposta apresentada. “O projeto vai andar no momento adequado, ele pode esperar para ter um Jornal Nacional, um Jornal da Band, ou da TV Record, ele pode esperar”, disse.
: Valter Campanato/Agência Brasil)Sérgio Moro vinha sendo considerado o herói contra a corrupção do Brasil. Após a vitória de Bolsonaro, o presidente convidou o ex-juiz para comandar o Ministério da Justiça e lhe garantiu superpoderes e total autonomia.
Moro disse ter aceitado o convite de Bolsonaro por estar “cansado de tomar bola nas costas”. Ele assumiu o cargo dizendo que teria total autonomia e status de super ministério. Isso foi só ilusão, pois, na prática, até o momento, Moro só teve derrotas.
Como primeira medida, o presidente Jair Bolsonaro fez um decreto flexibilizando a posse de armas. Moro tentou se desvincular dessa ideia e propôs ao presidente que o decreto permitisse apenas 2  armas por pessoa. A ideia de Moro foi completamente ignorada e o decreto surgiu permitindo quatro armas por pessoa.
E quando o ministro enviou ao Congresso o projeto anticrime, o Palácio do Planalto exigiu que a proposta de criminalização do caixa dois tramitasse separadamente do restante do projeto.
O clã Bolsonaro se irritou com o ministro quando ele indicou Ilona Szabó para o Conselho Nacional de Política Criminal e Penitenciária. A magistrada é contrária ao afrouxamento das regras de acesso a armas e criticou a ideia de ampliação do direito à legítima defesa que está no projeto do ministro. Moro foi obrigado a exonera-la após a pressão do presidente.
 
 
 
",Política,Entenda todos os passos do conflito entre Maia e Moro,As prisões de Michel Temer e Moreira Franco foram mesmo uma forma de Sérgio Moro atingir Rodrigo Maia?,2019-03-21 19:38:18
