author,url,text,section,title,sub_title,date
Thais Reis Oliveira,https://www.cartacapital.com.br/economia/por-que-bolsonaro-quer-acabar-com-o-horario-de-verao/,"A promessa provocou uma onda de repercussão nas redes sociais, e vem dividindo opiniões. A hashtag #Horáriodeverão é um dos assuntos mais comentados no Twitter. Mas quais são as razões, afinal, para acabar com a medida?Eu me recuso a dar a minha opinião sobre esse factoide do horário de verão desse governo de 13 milhões de desempregados. A próxima medida será decidir, por decreto, se é biscoito e bolacha.
GOVERNEM.
O país está um caos.— Rita Lisauskas (@RitaLisauskas)  O fim do horário de verão só confirma que o brasileiro nunca mais dará um sorriso durante esse governo baixo-astral. O cara não dá uma dentro e parece que tá aí há uns três anos já— marco reus (@zitaellen)  O que seu Presidente fez pelo Brasil?– O meu tirou o país do mapa da fomeE o seu?– O meu acabou com o horário de verão— Haddad Debochado (@HaddadDebochado) O horário de verão vigora desde 1931 como estratégia para economia de energia, já que as pessoas chegavam em casa e ligavam os chuveiros, gerando pico de energia e desperdício. Mais recentemente, associações e pesquisadores dizem que a mudança já não faz sentido do ponto de vista energético — o grande vilão do consumo elétrico é o ar-condicionado, que passa maiores períodos ligados. A Associação Brasileira das Empresas de Serviços de Conservação de Energia (Abesco) aponta, inclusive, um aumento no consumo de eletricidade nos últimos anos.Por outro lado, o anoitecer postergado favorece o setor de lazer. A Associação de Bares e Restaurantes de São Paulo calcula que o movimento em bares chega a crescer 20% durante o horário de verão. Em restaurantes, esse aumento é de 10%.O movimento para acabar com o horário de verão no Brasil já havia começado em 2017, no governo Temer. Mas o ex-presidente evitou bater o martelo, justamente porque essa é uma questão polêmica. No ano passado, porém, o período de horário diferenciado encolheu: foi de 4 de novembro de 2018 a 16 de fevereiro, a pedidos do TSE para não comprometer a divulgação dos resultados das eleições.",Economia,Por que Bolsonaro quer acabar com o horário de verão?,"O anoitecer postergado favorece o setor de lazer: movimento em bares chega a crescer 20% e em restaurantes, 10%",2019-04-05 16:17:14
Daniel Camargos,https://www.cartacapital.com.br/carta-capital/ex-pistoleiro-da-udn-se-tivesse-a-oportunidade-entraria-para-o-mst/,"Osnir Sanches foi um dos responsáveis por organizar uma milícia armada paga pela União Democrática Ruralista (UDR) no final da década de 1990. Era o “chefe de segurança”, como explica em entrevista à , com a função de contratar soldados para um exército clandestino a serviço de fazendeiros do interior do Paraná. A atuação de Sanches o levou a ser um dos quatro condenados pelo assassinato do integrante do MST Sebastião Camargo, executado em fevereiro de 1998.Apesar de ter sido sentenciado a 14 anos de prisão, Sanches ficou só um mês atrás das grades, graças a um habeas corpus. Ele nega a sua responsabilidade no crime, mas dá detalhes de como funcionava o treinamento de pistoleiros na organização e acusa a UDR de tê-lo abandonado. “Acabou com a minha vida. Estou pagando por uma coisa que não fiz”, afirmou.Criada em 1985 para se contrapor ao avanço do MST, a UDR é presidida desde o início dos anos 2000 pelo pecuarista Luiz Antônio Nabhan Garcia, atual secretário de Assuntos Fundiários do Ministério da Agricultura. Nabhan Garcia comandou a organização até o ano passado, quando se licenciou para ser o responsável pela reforma agrária no Brasil, além da demarcação de terras indígenas e quilombolas. O secretário do governo Bolsonaro chegou a ser investigado pela contratação de pistoleiros nos anos 2000, mas nunca foi indiciado.    Sanches diz não ter conhecido Nabhan Garcia, mas ambos atuaram na mesma época na UDR. Enquanto o pistoleiro organizava milícias armadas na margem paranaense do rio Paranapanema, Nabhan atuava do lado paulista do rio, no Pontal do Paranapanema, em Presidente Prudente.“Levavam a gente para uma beira de rio, uma fazenda lá no Mato Grosso. A gente ficava lá 8, 10 dias fazendo treinamento, aprendia como manejar uma arma. Eu ia”, recorda Sanches sobre o treinamento organizado pela UDR com os pistoleiros contratados por ele.Quem financiava a UDR, segundo Sanches, eram os fazendeiros – que recorriam à organização para retirar à força os sem-terras das fazendas ocupadas.No episódio pelo qual o pistoleiro foi condenado, cerca de 30 homens encapuzados e armados chegaram ao acampamento do MST na fazenda Boa Sorte, em Marilena (PR), e ordenaram que os trabalhadores rurais ficassem deitados no chão, com a cabeça virada para baixo. Sebastião Camargo, de 60 anos, tinha problemas na coluna e não se abaixou. Foi assassinado com um tiro de espingarda calibre 12 na cabeça. Era pai de cinco filhos.Sanches diz que não tinha a intenção de matar e que não foi ele quem atirou. “Eu peguei o Sebastião, coloquei no carro e levei para o hospital”, recorda. Quatro testemunhas que prestaram depoimento durante a ação penal afirmaram que o responsável pelo disparo que matou Sebastião foi feito pelo então presidente da UDR, Marcos Prochet.A tese de que Prochet foi o autor dos disparos foi defendida pela acusação e acatada pelos dois júris que condenaram o ex-presidente da UDR pela execução do crime. O primeiro, ocorrido em 2013, o condenou, mas foi anulado em 2014. O segundo júri, de 2016, foi novamente anulado em novembro de 2018.Bolsonaro com Nabhan Garcia (Foto: arquivo pessoal) Já Sanches, chefe dos pistoleiros, é condenado por homicídio qualificado e constituição de empresa de segurança privada utilizada para recrutar pistoleiros e executar despejos ilegais. Em sua defesa, diz que não era o responsável pelo armamento e que sempre dizia a seus homens: “Não é para atirar em ninguém, não é para machucar ninguém.”. Sanches também não se considera pistoleiro: “Eu era segurança. Esse termo de pistoleiro quem colocou foi o MST.” Os advogados da família do sem-terra executado voltaram a pedir a sua prisão.Ele está livre há tanto tempo que chegou a se esquecer que é condenado. Quando foi votar, no ano passado, foi impedido, pois de acordo com a legislação a sentença criminal suspende os direitos políticos. “Os mesários falaram para que eu fosse ao cartório. Aí eu lembrei [que era condenado]”, recorda.Hoje com 63 anos e avô de quatro netos, Sanches chegou a ajuizar uma ação pedindo reconhecimento de vínculo trabalhista com a UDR, onde trabalhou por três anos, entre 1998 e 2001. Não teve sucesso. “O juiz entendeu que não tinha vínculo trabalhista pois a profissão do Osnir não era lícita”, disse o advogado dele na causa, Jurandir Domingos Terra.Como Sanches, Nabhan Garcia também foi investigado por ter comandado milícias e pistoleiros pela UDR. Ao contrário do pistoleiro, porém, o secretário do governo Bolsonaro nunca foi indiciado.Nabhan foi acusado de participar da contratação e do treinamento dos pistoleiros que feriram oito sem-terras a bala em 1997, durante ação da UDR para desocupar uma fazenda em Sandovalina (SP). A acusação foi feita pelo fazendeiro Manoel Domingues Paes Neto, em depoimento à Polícia Federal anos depois do episódio. A denúncia chegou até a Comissão Parlamentar Mista de Inquérito da Terra (CPMI da Terra).  O relatório final da comissão pedia o indiciamento de Nabhan Garcia e de outros fazendeiros pelos crimes, mas a articulação política de deputados da bancada ruralista como o Alberto Lupion (DEM-PR), que foi relator da CPMI, e Onyx Lorenzoni (DEM-RS), vice-presidente da comissão, conseguiu alterar o relatório final e livrar o atual secretário. Lorenzoni é atualmente ministro da Casa Civil e Lupion assessor especial da mesma pasta no governo Bolsonaro.“Nem eu e nem a UDR nunca fomos condenados”, afirmou o secretário Nabhan Garcia à . Ao ser questionado sobre a morte de Sebastião Camargo e a condenação de Osnir Sanches, que trabalhou para UDR , o secretário ficou irritado e desligou o telefone.Quando Nabhan Garcia depôs na CPMI da Terra, em 2004, disse que desconhecia qualquer tipo de milícia no Brasil. “Milícia armada, realmente não conheço e não quero conhecer. A única milícia que conheço é o MST.”A  entrevistou um dos integrantes do MST que enfrentou as milícias armadas da UDR no Pontal do Paranapanema. Ele pediu para não ser identificado por medo de represálias e afirma que a atuação de Nabhan Garcia começou em 1994, agenciando a contratação de pistoleiros no Mato Grosso para enfrentar o movimento. Nabhan Garcia, segundo o militante do MST, fazia a articulação entre os fazendeiros e promovia leilões de gado para arrecadar dinheiro para a compra de armas.Os conflitos entre UDR e MST eram intensos no Pontal do Paranapanema quando Nabhan assumiu a presidência da entidade. Em 2003, o então presidente Luiz Inácio Lula da Silva (PT) recebeu um grupo de integrantes sem-terra em Brasília e, ao final do encontro, posou para fotos com um boné vermelho do movimento.No mesmo dia, 15 fazendeiros mascarados exibiam suas armas em foto publicada na capa do jornal O Estado de São Paulo. O fazendeiro Paes Neto, que já havia sido preso, afirmou à Polícia Federal que era Nabhan Garcia o quinto mascarado armado na fotografia (da esquerda para direita). A afirmação foi posteriormente negada pelo fazendeiro, durante audiência no Senado.Passados 16 anos, Nabhan Garcia ostenta um chapéu de fazendeiro ao lado do presidente Jair Bolsonaro na fotografia que usa no perfil de Whatsapp. A proximidade com o chefe e o poder concentrado na Secretaria Especial de Assuntos Fundiários conferem ao ruralista o status de 23° ministro.Foi na presidência da UDR que o ruralista começou a se aproximar do então deputado Jair Bolsonaro. “Desde quando o Bolsonaro entrou no Congresso eu acompanho ele, que mesmo não sendo produtor rural sempre defendeu o setor produtivo.” Em 2018, Nabhan Garcia se empenhou na campanha do atual presidente, ciceroneando o então candidato por feiras agropecuárias e em encontros com empresários rurais.Com menos de três meses de governo, o secretário prepara uma série de ações que afetam o Instituto Nacional de Colonização e Reforma Agrária (Incra) e dispara uma metralhadora de frases de efeito. Já disse em entrevistas que não dorme sem estar armado, que os maiores latifundiários do Brasil são os indígenas e que as escolas do MST são “fabriquinhas” de ditadores.Nabhan Garcia, que foi protagonista em embate com o MST na década de 1990 (Foto: Agência Brasil)A condução da reforma agrária no governo Bolsonaro, até o momento, é um espelho do pensamento dos ruralistas. Desde janeiro, nenhum imóvel foi desapropriado e nenhum assentamento foi criado, de acordo com o Incra.Sob o guarda-chuva de Nabhan Garcia, o Incra passou a ser presidido pelo general João Carlos Jesus Corrêa, que no início do ano suspendeu todos os processos de reforma agrária, conforme revelado pela . Diante da repercussão negativa, o governo recuou. Porém, . Outra medida do instituto foi proibir o diálogo com entidades como o MST. , após recomendação contrária do Ministério Público Federal que apontou uma série de ilegalidades na medida.Com Nabhan, o Incra criou ainda um grupo de trabalho para reduzir cargos e reformular sua estrutura, possivelmente cortando superintendências em regiões com histórico de conflitos no Pará.Para o membro da coordenação-geral do MST, Alexandre Conceição, o processo de paralisação da reforma agrária começou no governo de Michel Temer com a política de emissão de títulos individuais em detrimento da política de criação de assentamentos.Agora, sob a gestão de Nabhan Garcia, a avaliação do dirigente do MST é que a política do governo Bolsonaro vai aumentar a paralisação e os conflitos serão inevitáveis no campo. “Somos contra a violência, pois na guerra só morrem os pobres”, afirma. “Você já viu massacre de latifundiário?”.“A reforma agrária não combina com o pensamento dos membros do governo. Eles entendem que os movimentos sociais são bandidos e agressores”, avalia a ex-ouvidora agrária Nacional, Maria de Oliveira, que mediou conflitos entre Nabhan Garcia e o MST no Pontal do Paranapanema.Nabhan Garcia explicou à  que o plano do governo para a reforma agrária é transformar assentados em “produtores rurais de fato”. Segundo ele, grande parte dos assentamentos são ociosos, irregulares ou viraram “favelas rurais”.“A reforma agrária foi feita de forma ideológica e política. Não foram obedecidos critérios para trazer, para os assentamentos, as pessoas que têm perfil de produtor rural”, afirma. Um “pente-fino” está sendo feito, segundo ele, para identificar os assentados que estão produzindo. “Não dá para ficar na ociosidade e transformar a reforma agrária em um comércio de lotes.”O secretário do governo reafirma que não conversa com o MST. “Não vou aceitar viés ideológico de quem invade propriedade. O Brasil não é uma republiqueta. Quem invade propriedade comete crime”, avalia.",CartaCapital,"Arrependido, ex-pistoleiro da UDR detalha milícia e diz que entraria para o MST","‘Chefe’ se diz arrependido e detalha como atuavam pistoleiros em organização presidida por Nabhan Garcia, secretário de Bolsonaro",2019-04-05 03:30:58
Redação,https://www.cartacapital.com.br/politica/em-live-com-moro-bolsonaro-fala-tres-minutos-sobre-piscicultura/,"O assunto teve mais atenção que a reforma da Previdência — 2 minutos e 32 segundos, dos quais 37 segundos serviram para rebater informações que circularam na imprensa. Sobre a reunião que teve mais cedo com partidos do centrão, disse que “não tratou de cargos” e garantiu que não gravou conversas com os políticos.Sergio Moro falou pouco. Inicialmente, citou dados da Operação Luz na Infância, de combate à pedofilia e falou a tramitação do pacote anticrime. Também aproveitou para divulgar seu recém-criado perfil no Twitter. “Se não der certo, a culpa é do Bolsonaro.”O paranaense se demorou mais ao citar a operação Aliança, que derrubou dez toneladas de maconha ainda no pé. Segundo ele, a ideia é repetir e intensificar esse tipo de operação ao longo do ano, porque a operação tem “um potencial muito grande para afastar as drogas da população brasileira”.Em meio a elogios a Israel, Bolsonaro destacou uma parceria com o país para fomentar o cultivo de peixes. O presidente prometeu enviar universitários a intercâmbios de curta duração no país, para que eles aprendam técnicas de criação de peixes e técnicas de combate à seca, como o gotejamento.Também estaria em curso, segundo Bolsonaro, uma parceria com o Paraguai. “Quando estivemos em Itaipu, nós levantamos junto ao presidente usar o mar de água doce para cultivo de peixes. Foi feito o contato na hora. Nessa semana ou semana que vem, vão se encontrar para criar, em cercadinhos, tilápia e outros peixes que podem ser criados aí”, disse.O general Augusto Heleno, chefe do Gabinete de Segurança Institucional, também participou do encontro. Em uma longa declaração, de 2 minutos e 42 segundos, Heleno procurou colocou panos quentes nas críticas à postura do Brasil em relação ao mundo árabe, estremecida pelo alinhamento com Israel. “A comunidade árabe é numerosíssima, eles são nossos parceiros econômicos e isso não será afetado pela visita a Israel, vamos continuar a cultivar esse relacionamento com a comunidade árabe.”",Política,"Em “live” com Moro, Bolsonaro fala três minutos sobre… piscicultura",Assunto teve mais atenção que a Reforma da Previdência e pacote anticrime,2019-04-04 23:50:13
Thais Reis Oliveira,https://www.cartacapital.com.br/politica/apos-denuncia-governo-diz-a-onu-que-nao-houve-golpe-militar-no-brasil/,"O telegrama foi revelado em primeira mão pela  e confirmado posteriormente por CartaCapital. Diz o texto que “não houve golpe militar” em 1964 no Brasil, e que a tomada do poder pelas Forças Armadas serviu para afastar ameaças de “uma tomada comunista”, além de “garantir a preservação das instituições nacionais, no contexto da Guerra Fria”.  O governo afirma ainda que “os anos 1960-70 foram um período de intensa mobilização de organizações terroristas de esquerda no Brasil e em toda a América Latina”, e que a derrubada de João Goulart foi apoiada pela “maioria dos brasileiros”.
Trata-se de uma resposta às  para Promoção da Verdade, Justiça, Reparação e Garantias de Não Repetição. Na sexta-feira 29, Savioli exigiu que Bolsonaro reconsiderasse seus planos de celebrar um regime que cometeu “crimes horrendos” é “imoral e inadmissível”.  O parecer de Savioli foi classificado como “sem fundamento”. O governo brasileiro pediu ainda que o relator “deve respeitar os processos nacionais e procedimentos internos em suas deliberações”.
Em sua defesa, o governo evocou defesa da liberdade de expressão e reforçou que a recomendação de Jair Bolsonaro para que os quartéis comemorassem a data “foi tomada com pleno respeito à lei nacional, incluindo a Constituição Federal”.  O apelo da autoridade da ONU ocorreu depois de uma . No pedido, as organizações alertam para uma “tentativa de modificar a narrativa sobre o golpe de 31 de março de 1964 no Brasil”, cuja principal atuação viria “através de instruções diretas do Gabinete da Presidência ao mais alto comando militar para transmitir uma mensagem positiva sobre o período, desconsiderando as atrocidades cometidas pelo respectivo regime.”
Também pegaram mal lá fora as declarações de Bolsonaro e do chanceler Ernesto Araújo sobre . Durante viagem a Israel, o presidente corroborou a tese de Araújo e afirmou categoricamente que o nazismo é de esquerda: afinal, o partido de Hitler tinha  no nome.
Representantes de partidos políticos da Alemanha comentaram o caso ao blog do jornalista Jamil Chade, do  e atacaram o presidente. A deputada Yasmin Fahimi, do Partido Social-Democrata, lembrou que “os nazistas também usaram o termo ‘social’ como uma máscara para seu real programa político” e disse que Bolsonaro, ao usar essas mesmas estratégias, faz “ridicularização inaceitável das vítimas que foram mortas pelos nazistas”. O PSD, vale lembrar, faz parte da coalizão que governa a Alemanha e tem papel importante nos assuntos internacionais do país.
",Política,"Em carta, governo diz à ONU que não houve golpe militar no Brasil","Conforme o telegrama enviado à entidade, tomada do poder pelas Forças Armadas serviu para afastar uma ",2019-04-04 19:10:23
Redação,https://www.cartacapital.com.br/politica/apos-gafe-de-moro-conge-ganha-definicao-no-dicionario-informal/,"Alguém me explica o que é :
“CONGE”
“agir SOBRE a violenta emoção….”
“VIM a ser condenada”
Esse é o fino português do exemplar de Juiz da república de Curitiba
“In dubio PAU no réu”    — Walter (@WalterAugustoF) 
Com a chancela ministerial do superministro, o termo foi adicionado ao Dicionário Informal, site que define palavras não encontradas no vocabulário tradicional. “Uma iniciativa de documentar on-line a evolução do português”, diz a definição do portal.  
Na comissão do Senado, Moro voltou a defender o endurecimento das punições a crimes de corrupção e a crimes contra a vida, foco do pacote anticrime apresentado por ele ao Congresso em fevereiro.
",Política,"Após gafe de Moro, “conge” ganha definição no Dicionário Informal",O ex-juiz da Lava Jato deu uma escorregada no Português ao pronunciar a palavra cônjuge durante sessão na CCJ do Senado,2019-04-04 16:31:56
The Observer,https://www.cartacapital.com.br/sociedade/neofeminismo-busca-resgatar-a-ideia-de-que-sexo-nao-e-submissao/,"No dia do lançamento do livro-manifesto, Stephanie Theobald dirigiu por Londres com um clitóris de 1,20 metro no banco traseiro do seu Mustang. (Foto: Reprodução/Twitter)Mulher sentada de coxas abertas, de Gustav Klimt. ”É hora de toda mulher prestar atenção à sua anatomia, descobrir por si só as áreas de prazer”A dominatrix Reba Maybury quer, com seus artefatos, mudar o equilíbrio de poder entre os sexos",Sociedade,Neofeminismo busca resgatar a ideia de que sexo não é submissão,"Ativistas estão começando uma conversa em que as mulheres não são mais mercadorias sexuais, mas consumidoras sexuais",2019-04-05 03:30:51
Alexandre Putti,https://www.cartacapital.com.br/politica/ideia-big-data-bolsonaro-encerra-marco-com-pior-avaliacao-desde-1995/,"A parcela da população que avalia o governo como ótimo ou bom despencou de 50% para 38%. Quem avalia o governo como ruim ou péssimo subiu para 27%, 5 pontos percentuais acima do dado de janeiro. A pesquisa estima que cerca de 15 milhões de pessoas que votaram em Bolsonaro deixaram de avaliar seu governo de maneira positiva.  O primeiro semestre de um primeiro mandato presidencial é sempre considerado a “lua de mel”, fase em que os deslizes são perdoados e os defeitos relevados pela maior parte dos eleitores. Foi assim com FHC, Lula e Dilma, mas não com Bolsonaro.Muito disso se deve ao fato de o presidente ter se envolvido em diversas polêmicas ao longo desses três meses. Além disso, Bolsonaro, que se diz “contra a velha política”, não está fazendo uma articulação com o Congresso, o que iniciou uma guerra entre os dois poderes.  Com a oscilação do apoio à reforma da Previdência, o mercado reagiu, o dólar disparou e a bolsa caiu, chegando no mesmo patamar do auge da crise do governo Dilma.O desemprego aumentou e até o momento o governo não conseguiu emplacar nenhuma pauta positiva com potencial para apaziguar os ânimos. David Fleischer, cientista político da Universidade de Brasília, disse em entrevista à : “Não é possível governar um país pelo Twitter”. É palpável o desgaste provocado por discussões fátuas nas redes sociais, envolvendo o presidente, os filhos, ministros e o indefectível guru do governo, Olavo de Carvalho. ",Política,Ideia Big Data: Bolsonaro encerra março com pior avaliação desde 1995,A parcela da população que avalia o governo como ótimo ou bom diminuiu de 50% para 38%,2019-04-05 14:26:50
